{
  "schema_version": "1.0",
  "generated_at": "2026-07-05T00:20:04Z",
  "data_status": "real",
  "model": "lightgbm",
  "target": "pm2_5",
  "sample_n": 1000,
  "features": [
    {
      "name": "temperature_celsius",
      "mean_abs_shap": 3.3503
    },
    {
      "name": "humidity",
      "mean_abs_shap": 5.0566
    },
    {
      "name": "wind_kph",
      "mean_abs_shap": 0.7913
    },
    {
      "name": "wind_degree",
      "mean_abs_shap": 1.0872
    },
    {
      "name": "pressure_mb",
      "mean_abs_shap": 1.1121
    },
    {
      "name": "precip_mm",
      "mean_abs_shap": 1.3701
    },
    {
      "name": "cloud",
      "mean_abs_shap": 2.8483
    },
    {
      "name": "visibility_km",
      "mean_abs_shap": 4.8717
    },
    {
      "name": "uv_index",
      "mean_abs_shap": 3.3114
    },
    {
      "name": "gust_kph",
      "mean_abs_shap": 2.1757
    }
  ],
  "beeswarm": [
    {
      "feature": "temperature_celsius",
      "points": [
        {
          "shap": -2.2128,
          "feature_value_norm": 0.5761
        },
        {
          "shap": 0.8728,
          "feature_value_norm": 0.7313
        },
        {
          "shap": -0.8098,
          "feature_value_norm": 0.7642
        },
        {
          "shap": 0.0407,
          "feature_value_norm": 0.7299
        },
        {
          "shap": 1.1352,
          "feature_value_norm": 0.4597
        },
        {
          "shap": -3.3152,
          "feature_value_norm": 0.5672
        },
        {
          "shap": -1.8416,
          "feature_value_norm": 0.691
        },
        {
          "shap": -4.8664,
          "feature_value_norm": 0.6418
        },
        {
          "shap": 2.7396,
          "feature_value_norm": 0.3761
        },
        {
          "shap": -4.4678,
          "feature_value_norm": 0.5776
        },
        {
          "shap": 0.2377,
          "feature_value_norm": 0.2403
        },
        {
          "shap": -1.6573,
          "feature_value_norm": 0.6149
        },
        {
          "shap": -3.794,
          "feature_value_norm": 0.5731
        },
        {
          "shap": -3.6003,
          "feature_value_norm": 0.7164
        },
        {
          "shap": 10.4191,
          "feature_value_norm": 0.791
        },
        {
          "shap": -6.1648,
          "feature_value_norm": 0.7478
        },
        {
          "shap": 5.061,
          "feature_value_norm": 0.7761
        },
        {
          "shap": 4.4942,
          "feature_value_norm": 0.403
        },
        {
          "shap": -1.1015,
          "feature_value_norm": 0.7478
        },
        {
          "shap": -4.8596,
          "feature_value_norm": 0.6448
        },
        {
          "shap": -2.5985,
          "feature_value_norm": 0.5687
        },
        {
          "shap": -3.3216,
          "feature_value_norm": 0.5358
        },
        {
          "shap": -4.3723,
          "feature_value_norm": 0.5358
        },
        {
          "shap": 1.703,
          "feature_value_norm": 0.4761
        },
        {
          "shap": -0.0982,
          "feature_value_norm": 0.6269
        },
        {
          "shap": -0.6942,
          "feature_value_norm": 0.6537
        },
        {
          "shap": -2.4695,
          "feature_value_norm": 0.6254
        },
        {
          "shap": 16.0687,
          "feature_value_norm": 0.8045
        },
        {
          "shap": -5.9515,
          "feature_value_norm": 0.7299
        },
        {
          "shap": -3.7645,
          "feature_value_norm": 0.5657
        },
        {
          "shap": 0.2385,
          "feature_value_norm": 0.3582
        },
        {
          "shap": -0.3029,
          "feature_value_norm": 0.5493
        },
        {
          "shap": -1.063,
          "feature_value_norm": 0.7194
        },
        {
          "shap": -0.5459,
          "feature_value_norm": 0.4478
        },
        {
          "shap": -2.1092,
          "feature_value_norm": 0.6582
        },
        {
          "shap": -3.6993,
          "feature_value_norm": 0.6821
        },
        {
          "shap": -3.4372,
          "feature_value_norm": 0.597
        },
        {
          "shap": -4.2839,
          "feature_value_norm": 0.506
        },
        {
          "shap": -1.0466,
          "feature_value_norm": 0.7612
        },
        {
          "shap": -3.1031,
          "feature_value_norm": 0.6284
        },
        {
          "shap": -0.4484,
          "feature_value_norm": 0.7179
        },
        {
          "shap": 4.7485,
          "feature_value_norm": 0.4522
        },
        {
          "shap": -5.9667,
          "feature_value_norm": 0.506
        },
        {
          "shap": -1.6749,
          "feature_value_norm": 0.6701
        },
        {
          "shap": -5.5203,
          "feature_value_norm": 0.506
        },
        {
          "shap": 12.1305,
          "feature_value_norm": 0.806
        },
        {
          "shap": -2.8299,
          "feature_value_norm": 0.5672
        },
        {
          "shap": -2.142,
          "feature_value_norm": 0.7463
        },
        {
          "shap": -11.8271,
          "feature_value_norm": 0.5761
        },
        {
          "shap": -3.3985,
          "feature_value_norm": 0.7313
        },
        {
          "shap": -0.9135,
          "feature_value_norm": 0.7045
        },
        {
          "shap": 1.272,
          "feature_value_norm": 0.8776
        },
        {
          "shap": -2.1398,
          "feature_value_norm": 0.5821
        },
        {
          "shap": 2.7605,
          "feature_value_norm": 0.4433
        },
        {
          "shap": -0.9512,
          "feature_value_norm": 0.6896
        },
        {
          "shap": -1.99,
          "feature_value_norm": 0.7418
        },
        {
          "shap": 3.6171,
          "feature_value_norm": 0.7507
        },
        {
          "shap": -4.256,
          "feature_value_norm": 0.5657
        },
        {
          "shap": 4.8816,
          "feature_value_norm": 0.7791
        },
        {
          "shap": 1.217,
          "feature_value_norm": 0.7597
        },
        {
          "shap": -1.7287,
          "feature_value_norm": 0.6552
        },
        {
          "shap": -3.1438,
          "feature_value_norm": 0.5955
        },
        {
          "shap": -3.1221,
          "feature_value_norm": 0.597
        },
        {
          "shap": -4.0191,
          "feature_value_norm": 0.5821
        },
        {
          "shap": 0.7329,
          "feature_value_norm": 0.297
        },
        {
          "shap": -3.7837,
          "feature_value_norm": 0.6642
        },
        {
          "shap": -2.9719,
          "feature_value_norm": 0.6866
        },
        {
          "shap": -0.4502,
          "feature_value_norm": 0.7597
        },
        {
          "shap": -0.2835,
          "feature_value_norm": 0.3358
        },
        {
          "shap": -2.8058,
          "feature_value_norm": 0.5075
        },
        {
          "shap": -1.25,
          "feature_value_norm": 0.7
        },
        {
          "shap": -1.5383,
          "feature_value_norm": 0.6985
        },
        {
          "shap": -2.3581,
          "feature_value_norm": 0.6597
        },
        {
          "shap": 5.7324,
          "feature_value_norm": 0.7493
        },
        {
          "shap": -5.1453,
          "feature_value_norm": 0.6701
        },
        {
          "shap": -2.4312,
          "feature_value_norm": 0.6746
        },
        {
          "shap": -3.1642,
          "feature_value_norm": 0.6254
        },
        {
          "shap": -1.3161,
          "feature_value_norm": 0.6925
        },
        {
          "shap": -1.7314,
          "feature_value_norm": 0.7403
        },
        {
          "shap": -5.2336,
          "feature_value_norm": 0.5045
        },
        {
          "shap": 6.2701,
          "feature_value_norm": 0.3701
        },
        {
          "shap": 4.812,
          "feature_value_norm": 0.7687
        },
        {
          "shap": -3.482,
          "feature_value_norm": 0.6716
        },
        {
          "shap": -0.039,
          "feature_value_norm": 0.7597
        },
        {
          "shap": -2.6881,
          "feature_value_norm": 0.6746
        },
        {
          "shap": -2.0817,
          "feature_value_norm": 0.6776
        },
        {
          "shap": 3.5134,
          "feature_value_norm": 0.4194
        },
        {
          "shap": 0.9115,
          "feature_value_norm": 0.7627
        },
        {
          "shap": -3.04,
          "feature_value_norm": 0.491
        },
        {
          "shap": -1.3165,
          "feature_value_norm": 0.6896
        },
        {
          "shap": 3.3255,
          "feature_value_norm": 0.7313
        },
        {
          "shap": -2.4864,
          "feature_value_norm": 0.5955
        },
        {
          "shap": -1.3469,
          "feature_value_norm": 0.706
        },
        {
          "shap": -2.0986,
          "feature_value_norm": 0.5552
        },
        {
          "shap": -1.5662,
          "feature_value_norm": 0.6955
        },
        {
          "shap": 3.7726,
          "feature_value_norm": 0.7463
        },
        {
          "shap": -4.2233,
          "feature_value_norm": 0.5806
        },
        {
          "shap": -4.2862,
          "feature_value_norm": 0.7015
        },
        {
          "shap": 3.72,
          "feature_value_norm": 0.3299
        },
        {
          "shap": -7.1123,
          "feature_value_norm": 0.5627
        },
        {
          "shap": 2.3964,
          "feature_value_norm": 0.7761
        },
        {
          "shap": -1.8782,
          "feature_value_norm": 0.7
        },
        {
          "shap": 0.6474,
          "feature_value_norm": 0.206
        },
        {
          "shap": -1.6172,
          "feature_value_norm": 0.6731
        },
        {
          "shap": 0.8656,